{
  "$schema": "https://raw.githubusercontent.com/rad1092/repolens/v0.4.0/.repolens.schema.json",
  "schema": 2,
  "excludes": [
    "**/.repolens/**",
    "**/fixtures/**",
    "**/__fixtures__/**",
    "**/testdata/**"
  ],
  "policy": {
    "failOn": "new-warning",
    "strict": false
  },
  "checks": {}
}
